<?xml version="1.0" encoding="UTF-8"?>
<annotations xmlns="http://www.ebi.ac.uk/~johnmay/"
             xmlns:xsi="http://www.w3.org/2001/XMLSchema-instance"
             xsi:schemaLocation="http://www.ebi.ac.uk/~johnmay/ chemet.xsd">
    <simple-annotation annotation-index="1">
        <value>ATP</value>
    </simple-annotation>
    <simple-annotation annotation-index="1">
        <value>Adeninosine Triphosphate</value>
    </simple-annotation>
    <author-annotation annotation-index="2">
        <name>johnmay</name>
        <comment>target compound</comment>
    </author-annotation>
</annotations>